cveID,vendorProject,product,vulnerabilityName,dateAdded,shortDescription,requiredAction,dueDate,knownRansomwareCampaignUse,notes,cwes
CVE-2025-61932,Motex,"LANSCOPE Endpoint Manager","Motex LANSCOPE Endpoint Manager Improper Verification of Source of a Communication Channel Vulnerability",2025-10-22,"Motex LANSCOPE Endpoint Manager contains an improper verification of source of a communication channel vulnerability allowing an attacker to execute arbitrary code by sending specially crafted packets.","Apply mitigations per vendor instructions, follow applicable BOD 22-01 guidance for cloud services, or discontinue use of the product if mitigations are unavailable.",2025-11-12,Unknown,"https://www.motex.co.jp/news/notice/2025/release251020/ ; https://nvd.nist.gov/vuln/detail/CVE-2025-61932",CWE-940
CVE-2025-61884,Oracle,"E-Business Suite","Oracle E-Business Suite Server-Side Request Forgery (SSRF) Vulnerability",2025-10-20,"Oracle E-Business Suite contains a server-side request forgery (SSRF) vulnerability in the Runtime component of Oracle Configurator. This vulnerability is remotely exploitable without authentication.","Apply mitigations per vendor instructions, follow applicable BOD 22-01 guidance for cloud services, or discontinue use of the product if mitigations are unavailable.",2025-11-10,Known,"https://www.oracle.com/security-alerts/alert-cve-2025-61884.html ; https://nvd.nist.gov/vuln/detail/CVE-2025-61884",CWE-918
CVE-2025-61882,Oracle,"E-Business Suite","Oracle E-Business Suite Unspecified Vulnerability",2025-10-06,"Oracle E-Business Suite contains an unspecified vulnerability in the BI Publisher Integration component. The vulnerability allows unauthenticated attacker with network access via HTTP to compromise Oracle Concurrent Processing. Successful attacks can result in takeover of Oracle Concurrent Processing.","Apply mitigations per vendor instructions, follow applicable BOD 22-01 guidance for cloud services, or discontinue use of the product if mitigations are unavailable.",2025-10-27,Known,"https://www.oracle.com/security-alerts/alert-cve-2025-61882.html ; https://nvd.nist.gov/vuln/detail/CVE-2025-61882",
CVE-2025-6558,Google,Chromium,"Google Chromium ANGLE and GPU Improper Input Validation Vulnerability",2025-07-22,"Google Chromium contains an improper input validation vulnerability in ANGLE and GPU. This vulnerability could allow a remote attacker to potentially perform a sandbox escape via a crafted HTML page. This vulnerability could affect multiple web browsers that utilize Chromium, including, but not limited to, Google Chrome, Microsoft Edge, and Opera.","Apply mitigations per vendor instructions, follow applicable BOD 22-01 guidance for cloud services, or discontinue use of the product if mitigations are unavailable.",2025-08-12,Unknown,"https://chromereleases.googleblog.com/2025/07/stable-channel-update-for-desktop_15.html ; https://nvd.nist.gov/vuln/detail/CVE-2025-6558",CWE-20
CVE-2025-6554,Google,"Chromium V8","Google Chromium V8 Type Confusion Vulnerability",2025-07-02,"Google Chromium V8 contains a type confusion vulnerability that could allow a remote attacker to perform arbitrary read/write via a crafted HTML page. This vulnerability could affect multiple web browsers that utilize Chromium, including, but not limited to, Google Chrome, Microsoft Edge, and Opera.","Apply mitigations per vendor instructions, follow applicable BOD 22-01 guidance for cloud services, or discontinue use of the product if mitigations are unavailable.",2025-07-23,Unknown,"https://chromereleases.googleblog.com/2025/06/stable-channel-update-for-desktop_30.html?m=1 ; https://nvd.nist.gov/vuln/detail/CVE-2025-6554",CWE-843
CVE-2025-6543,Citrix,"NetScaler ADC and Gateway","Citrix NetScaler ADC and Gateway Buffer Overflow Vulnerability",2025-06-30,"Citrix NetScaler ADC and Gateway contain a buffer overflow vulnerability leading to unintended control flow and Denial of Service. NetScaler must be configured as Gateway (VPN virtual server, ICA Proxy, CVPN, RDP Proxy) OR AAA virtual server.","Apply mitigations per vendor instructions, follow applicable BOD 22-01 guidance for cloud services, or discontinue use of the product if mitigations are unavailable.",2025-07-21,Unknown,"https://support.citrix.com/support-home/kbsearch/article?articleNumber=CTX694788 ; https://www.netscaler.com/blog/news/netscaler-critical-security-updates-for-cve-2025-6543-and-cve-2025-5777/ ;   https://nvd.nist.gov/vuln/detail/CVE-2025-6543",CWE-119
