cveID,vendorProject,product,vulnerabilityName,dateAdded,shortDescription,requiredAction,dueDate,knownRansomwareCampaignUse,notes,cwes
CVE-2014-6278,GNU,"GNU Bash","GNU Bash OS Command Injection Vulnerability",2025-10-02,"GNU Bash contains an OS command injection vulnerability which allows remote attackers to execute arbitrary commands via a crafted environment.","Apply mitigations per vendor instructions, follow applicable BOD 22-01 guidance for cloud services, or discontinue use of the product if mitigations are unavailable. ",2025-10-23,Unknown,"This vulnerability could affect an open-source component, third-party library, protocol, or proprietary implementation that could be used by different products. For more information, please see: http://ftp.gnu.org/gnu/bash/bash-4.3-patches/bash43-027 ; https://support.broadcom.com/web/ecx/support-content-notification/-/external/content/SecurityAdvisories/0/23467 ; https://sec.cloudapps.cisco.com/security/center/content/CiscoSecurityAdvisory/cisco-sa-20140926-bash ; https://www.ibm.com/support/pages/security-bulletin-update-vulnerabilities-bash-affect-aix-toolbox-linux-applications-cve-2014-6271-cve-2014-6277-cve-2014-6278-cve-2014-7169-cve-2014-7186-and-cve-2014-7187 ; https://nvd.nist.gov/vuln/detail/CVE-2014-6278",CWE-78
CVE-2014-6332,Microsoft,Windows,"Microsoft Windows Object Linking & Embedding (OLE) Automation Array Remote Code Execution Vulnerability",2022-03-25,"OleAut32.dll in OLE in Microsoft Windows allows remote attackers to remotely execute code via a crafted web site.","Apply updates per vendor instructions.",2022-04-15,Unknown,https://nvd.nist.gov/vuln/detail/CVE-2014-6332,CWE-119
CVE-2014-6324,Microsoft,"Kerberos Key Distribution Center (KDC)","Microsoft Kerberos Key Distribution Center (KDC) Privilege Escalation Vulnerability",2022-03-25,"The Kerberos Key Distribution Center (KDC) in Microsoft allows remote authenticated domain users to obtain domain administrator privileges.","Apply updates per vendor instructions.",2022-04-15,Unknown,https://nvd.nist.gov/vuln/detail/CVE-2014-6324,CWE-264
CVE-2014-6287,Rejetto,"HTTP File Server (HFS)","Rejetto HTTP File Server (HFS) Remote Code Execution Vulnerability",2022-03-25,"The findMacroMarker function in parserLib.pas in Rejetto HTTP File Server (HFS or HttpFileServer) allows remote attackers to execute arbitrary programs.","Apply updates per vendor instructions.",2022-04-15,Unknown,https://nvd.nist.gov/vuln/detail/CVE-2014-6287,CWE-94
CVE-2014-6352,Microsoft,Windows,"Microsoft Windows Code Injection Vulnerability",2022-02-25,"Microsoft Windows allow remote attackers to execute arbitrary code via a crafted OLE object.","Apply updates per vendor instructions.",2022-08-25,Unknown,https://nvd.nist.gov/vuln/detail/CVE-2014-6352,CWE-94
CVE-2014-6271,GNU,"Bourne-Again Shell (Bash)","GNU Bourne-Again Shell (Bash) Arbitrary Code Execution Vulnerability",2022-01-28,"GNU Bash through 4.3 processes trailing strings after function definitions in the values of environment variables, which allows remote attackers to execute code.","Apply updates per vendor instructions.",2022-07-28,Unknown,https://nvd.nist.gov/vuln/detail/CVE-2014-6271,CWE-78
