cveID,vendorProject,product,vulnerabilityName,dateAdded,shortDescription,requiredAction,dueDate,knownRansomwareCampaignUse,notes,cwes
CVE-2019-9621,Synacor,"Zimbra Collaboration Suite (ZCS)","Synacor Zimbra Collaboration Suite (ZCS) Server-Side Request Forgery (SSRF) Vulnerability",2025-07-07,"Synacor Zimbra Collaboration Suite (ZCS) contains a server-side request forgery (SSRF) vulnerability via the ProxyServlet component.","Apply mitigations per vendor instructions, follow applicable BOD 22-01 guidance for cloud services, or discontinue use of the product if mitigations are unavailable.",2025-07-28,Unknown,"https://wiki.zimbra.com/wiki/Zimbra_Security_Advisories ; https://wiki.zimbra.com/wiki/Security_Center ; https://nvd.nist.gov/vuln/detail/CVE-2019-9621","CWE-918, CWE-807"
CVE-2019-9875,Sitecore,"CMS and Experience Platform (XP)","Sitecore CMS and Experience Platform (XP) Deserialization Vulnerability",2025-03-26,"Sitecore CMS and Experience Platform (XP) contain a deserialization vulnerability in the Sitecore.Security.AntiCSRF module that allows an authenticated attacker to execute arbitrary code by sending a serialized .NET object in the HTTP POST parameter __CSRFTOKEN.","Apply mitigations per vendor instructions, follow applicable BOD 22-01 guidance for cloud services, or discontinue use of the product if mitigations are unavailable.",2025-04-16,Unknown,"https://support.sitecore.com/kb?id=kb_article_view&sysparm_article=KB0038556 ; https://nvd.nist.gov/vuln/detail/CVE-2019-9875",CWE-502
CVE-2019-9874,Sitecore,"CMS and Experience Platform (XP)","Sitecore CMS and Experience Platform (XP) Deserialization Vulnerability",2025-03-26,"Sitecore CMS and Experience Platform (XP) contain a deserialization vulnerability in the Sitecore.Security.AntiCSRF module that allows an unauthenticated attacker to execute arbitrary code by sending a serialized .NET object in the HTTP POST parameter __CSRFTOKEN.","Apply mitigations per vendor instructions, follow applicable BOD 22-01 guidance for cloud services, or discontinue use of the product if mitigations are unavailable.",2025-04-16,Unknown,"https://support.sitecore.com/kb?id=kb_article_view&sysparm_article=KB0334035 ; https://nvd.nist.gov/vuln/detail/CVE-2019-9874",CWE-502
CVE-2019-9670,Synacor,"Zimbra Collaboration Suite (ZCS)","Synacor Zimbra Collaboration Suite (ZCS) Improper Restriction of XML External Entity Reference",2022-01-10,"Synacor Zimbra Collaboration Suite (ZCS) contains an improper restriction of XML external entity (XXE) vulnerability in the mailboxd component.","Apply updates per vendor instructions.",2022-07-10,Unknown,https://nvd.nist.gov/vuln/detail/CVE-2019-9670,CWE-611
CVE-2019-9082,ThinkPHP,ThinkPHP,"ThinkPHP Remote Code Execution Vulnerability",2021-11-03,"ThinkPHP contains an unspecified vulnerability that allows for remote code execution via public//?s=index/\think\app/invokefunction&function=call_user_func_array&vars[0]=system&vars[1][]= followed by the command.","Apply updates per vendor instructions.",2022-05-03,Unknown,https://nvd.nist.gov/vuln/detail/CVE-2019-9082,"CWE-306, CWE-94"
CVE-2019-9978,WordPress,"Social Warfare Plugin","WordPress Social Warfare Plugin Cross-Site Scripting (XSS) Vulnerability",2021-11-03,"WordPress Social Warfare plugin contains a cross-site scripting (XSS) vulnerability that allows for remote code execution. This vulnerability affects Social Warfare and Social Warfare Pro.","Apply updates per vendor instructions.",2022-05-03,Unknown,https://nvd.nist.gov/vuln/detail/CVE-2019-9978,CWE-79
