cveID,vendorProject,product,vulnerabilityName,dateAdded,shortDescription,requiredAction,dueDate,knownRansomwareCampaignUse,notes,cwes
CVE-2010-3962,Microsoft,"Internet Explorer","Microsoft Internet Explorer Uninitialized Memory Corruption Vulnerability",2025-10-06,"Microsoft Internet Explorer contains an uninitialized memory corruption vulnerability that could allow for remote code execution. The impacted product could be end-of-life (EoL) and/or end-of-service (EoS). Users should discontinue product utilization.","Apply mitigations per vendor instructions, follow applicable BOD 22-01 guidance for cloud services, or discontinue use of the product if mitigations are unavailable.",2025-10-27,Unknown,"https://learn.microsoft.com/en-us/security-updates/SecurityAdvisories/2010/2458511?redirectedfrom=MSDN ; https://nvd.nist.gov/vuln/detail/CVE-2010-3962",
CVE-2010-3765,Mozilla,"Multiple Products","Mozilla Multiple Products Remote Code Execution Vulnerability",2025-10-06,"Mozilla Firefox, SeaMonkey, and Thunderbird contain an unspecified vulnerability when JavaScript is enabled. This allows remote attackers to execute arbitrary code via vectors related to nsCSSFrameConstructor::ContentAppended, the appendChild method, incorrect index tracking, and the creation of multiple frames, which triggers memory corruption.","Apply mitigations per vendor instructions, follow applicable BOD 22-01 guidance for cloud services, or discontinue use of the product if mitigations are unavailable.",2025-10-27,Unknown,"https://www.mozilla.org/en-US/security/advisories/mfsa2010-73 ; https://nvd.nist.gov/vuln/detail/CVE-2010-3765",
CVE-2010-3904,Linux,Kernel,"Linux Kernel Improper Input Validation Vulnerability",2023-05-12,"Linux Kernel contains an improper input validation vulnerability in the Reliable Datagram Sockets (RDS) protocol implementation that allows local users to gain privileges via crafted use of the sendmsg and recvmsg system calls.","The impacted product is end-of-life and should be disconnected if still in use.",2023-06-02,Unknown,"https://lkml.iu.edu/hypermail/linux/kernel/1601.3/06474.html; https://nvd.nist.gov/vuln/detail/CVE-2010-3904",CWE-20
CVE-2010-3035,Cisco,"IOS XR","Cisco IOS XR Border Gateway Protocol (BGP) Denial-of-Service Vulnerability",2022-03-25,"Cisco IOS XR, when BGP is the configured routing feature, allows remote attackers to cause a denial-of-service (DoS).","Apply updates per vendor instructions.",2022-04-15,Unknown,https://nvd.nist.gov/vuln/detail/CVE-2010-3035,CWE-20
CVE-2010-3333,Microsoft,Office,"Microsoft Office Stack-based Buffer Overflow Vulnerability",2022-03-03,"A stack-based buffer overflow vulnerability exists in the parsing of RTF data in Microsoft Office and earlier allows an attacker to perform remote code execution.","Apply updates per vendor instructions.",2022-03-24,Unknown,https://nvd.nist.gov/vuln/detail/CVE-2010-3333,CWE-119
